composer,author,year,title,publisher
Mozart,E. Stainkamph,1967,The Form & Analysis of Mozart’s Pianoforte Sonatas,Allan’s Music
Mozart,J. Salsbury,1917,"Short and Concise Analysis of Mozart’s Twenty-two Pianoforte Sonatas, With a Description of Some of the Various Forms",Weekes
Mozart,F.H. Marks,1921,"The Sonata: Its Form and Meaning as Exemplified in the Piano Sonatas by Mozart, A Descriptive Analysis",W. Reeves
Beethoven,D.F. Tovey,1951, Companion to Beethoven’s Pianoforte Sonatas (Bar-to-Bar Analysis),Associated Board of the Royal Schools of Music
Beethoven,E. Stainkamph,1968,Form & Analysis of the Complete Beethoven Piano Sonatas,Allan’s Music
Beethoven,H. Harding,2014,Analysis of Form: Beethoven’s 32 Piano Sonatas,CreateSpace Independent PublishingcPlatform
Haydn,E. Stainkamph,1970,The Form and Analysis of Twenty-Seven Haydn Pianoforte Sonatas,Allan’s Music
Haydn,S. Foster,1990,Tonal methods of cyclic unification in Haydn’s mature keyboard sonata,"The School of Music, Louisiana State University and Agricultural & Mechanical Col."
Haydn,B.A. Brown,1986,Joseph Haydn’s Keyboard Music : Sources and Style,Indiana University Press
Clementi,T.E.K. Radloff,1987,The piano sonatas of Muzio Clementi: an investigation into compositional aspects with special emphasis on developments in form and style,Rhodes University
Czerny,L. Larson,2015,An underestimated master: A critical analysis of Carl Czerny’s eleven piano sonatas and his contribution to the genre,University of Nebraska
